{
  "artifact": "placement_problem",
  "artifact_schema_version": "1.0",
  "candidates": [
    {
      "allowed_nodes": [
        "worker-01"
      ],
      "cpu_millicores": 1500,
      "exclusion_reasons": [],
      "ineligible_nodes": [],
      "memory_bytes": 2147483648,
      "pod": "analytics/batch-worker-8c9d0e-aaaaa",
      "replacement": "ASSUMED",
      "request_status": "EXACT",
      "unknown_nodes": [],
      "usable": true
    },
    {
      "allowed_nodes": [
        "worker-01"
      ],
      "cpu_millicores": 200,
      "exclusion_reasons": [],
      "ineligible_nodes": [],
      "memory_bytes": 268435456,
      "pod": "analytics/ingest-1a2b3c-aaaaa",
      "replacement": "ASSUMED",
      "request_status": "EXACT",
      "unknown_nodes": [],
      "usable": true
    },
    {
      "allowed_nodes": [
        "worker-01"
      ],
      "cpu_millicores": 1000,
      "exclusion_reasons": [],
      "ineligible_nodes": [],
      "memory_bytes": 1073741824,
      "pod": "analytics/reporter-9e8d7c-aaaaa",
      "replacement": "ASSUMED",
      "request_status": "REVIEW_REQUIRED",
      "unknown_nodes": [],
      "usable": true
    }
  ],
  "conditions": [
    {
      "code": "CANDIDATE_REQUEST_REVIEW_REQUIRED",
      "detail": "POD_LEVEL_FEATURE_STATE_UNCERTAIN,POD_LEVEL_REQUESTS_APPLIED,POD_REQUEST_REVIEW_REQUIRED",
      "subject": "analytics/reporter-9e8d7c-aaaaa"
    }
  ],
  "destinations": [
    {
      "accounting_status": "EXACT",
      "allocatable": {
        "cpu_millicores": 2000,
        "memory_bytes": 4294967296,
        "pods": 110
      },
      "exclusion_reasons": [],
      "node": "worker-01",
      "remaining": {
        "cpu_millicores": 300,
        "memory_bytes": 1073741824,
        "pods": 107
      },
      "usable": true
    },
    {
      "accounting_status": "EXACT",
      "allocatable": {
        "cpu_millicores": 2000,
        "memory_bytes": 4294967296,
        "pods": 110
      },
      "exclusion_reasons": [
        "BASELINE_OVERCOMMITTED"
      ],
      "node": "worker-03",
      "remaining": {
        "cpu_millicores": 500,
        "memory_bytes": -536870912,
        "pods": 108
      },
      "usable": false
    }
  ],
  "formulation": {
    "constraints": [
      "sum_n x[p,n] <= 1 for every candidate p (at most one destination)",
      "x[p,n] exists only for M1-ELIGIBLE pairs on usable destinations (eligibility)",
      "sum_p cpu[p] * x[p,n] <= remaining_cpu[n] for every destination n",
      "sum_p mem[p] * x[p,n] <= remaining_memory[n] for every destination n",
      "sum_p x[p,n] <= remaining_pods[n] for every destination n"
    ],
    "objective": [
      "1. maximize sum x[p,n] (pods placed)",
      "2. maximize, lexicographically, the ascending vector over usable destinations of min_r (remaining_r[n] - used_r[n]) / allocatable_r[n] for r in cpu, memory, pods (leximin balance)",
      "3. minimize the tie-break vector over candidates in pod-key order: (0, node) if placed, (1, '') if not"
    ],
    "variables": "x[p,n] in {0,1} for each allowed (candidate p, destination n) pair listed in 'variables'"
  },
  "generator": {
    "milestone": "M2",
    "name": "qplace",
    "version": "0.1.0"
  },
  "limitations": [
    {
      "code": "OVERCOMMITTED_DESTINATION_EXCLUDED",
      "detail": "remaining cpu=500 memory=-536870912 pods=108",
      "subject": "worker-03"
    },
    {
      "code": "REPLACEMENT_TEMPLATE_UNKNOWN",
      "detail": "replacement modeled from the current pod spec",
      "subject": "analytics/batch-worker-8c9d0e-aaaaa"
    },
    {
      "code": "REPLACEMENT_TEMPLATE_UNKNOWN",
      "detail": "replacement modeled from the current pod spec",
      "subject": "analytics/ingest-1a2b3c-aaaaa"
    },
    {
      "code": "REPLACEMENT_TEMPLATE_UNKNOWN",
      "detail": "replacement modeled from the current pod spec",
      "subject": "analytics/reporter-9e8d7c-aaaaa"
    }
  ],
  "policy_excluded_pairs": [
    {
      "node": "worker-03",
      "pod": "analytics/batch-worker-8c9d0e-aaaaa"
    },
    {
      "node": "worker-03",
      "pod": "analytics/ingest-1a2b3c-aaaaa"
    },
    {
      "node": "worker-03",
      "pod": "analytics/reporter-9e8d7c-aaaaa"
    }
  ],
  "source": {
    "capacity_assessment_complete": true,
    "captured_at": "2026-10-02T09:00:00Z",
    "kubernetes_version": "v1.33.2",
    "snapshot_id": "fixture-b-insufficient",
    "snapshot_schema_version": "1.0",
    "source_file": "fixture_b_insufficient.json",
    "source_sha256": "6959fbc701e487288f5caeab3e42963506b4c1b773811f3d371a0316846ea04a",
    "source_type": "synthetic_fixture"
  },
  "summary": {
    "candidates": 3,
    "conditional": true,
    "destinations": 2,
    "usable_candidates": 3,
    "usable_destinations": 1,
    "variables": 3
  },
  "target_node": "worker-02",
  "units": {
    "cpu": "millicores",
    "memory": "bytes",
    "pods": "count"
  },
  "variables": [
    {
      "index": 0,
      "node": "worker-01",
      "pod": "analytics/batch-worker-8c9d0e-aaaaa"
    },
    {
      "index": 1,
      "node": "worker-01",
      "pod": "analytics/ingest-1a2b3c-aaaaa"
    },
    {
      "index": 2,
      "node": "worker-01",
      "pod": "analytics/reporter-9e8d7c-aaaaa"
    }
  ]
}
