{
  "artifact": "placement_problem",
  "artifact_schema_version": "1.0",
  "candidates": [
    {
      "allowed_nodes": [
        "node-a",
        "node-b"
      ],
      "cpu_millicores": 2000,
      "exclusion_reasons": [],
      "ineligible_nodes": [],
      "memory_bytes": 1073741824,
      "pod": "apps/batch-7a6b5c-aaaaa",
      "replacement": "ASSUMED",
      "request_status": "EXACT",
      "unknown_nodes": [],
      "usable": true
    },
    {
      "allowed_nodes": [
        "node-a"
      ],
      "cpu_millicores": 1500,
      "exclusion_reasons": [],
      "ineligible_nodes": [
        "node-b"
      ],
      "memory_bytes": 1073741824,
      "pod": "apps/indexer-8b7c6d-aaaaa",
      "replacement": "ASSUMED",
      "request_status": "EXACT",
      "unknown_nodes": [],
      "usable": true
    }
  ],
  "conditions": [],
  "destinations": [
    {
      "accounting_status": "EXACT",
      "allocatable": {
        "cpu_millicores": 2500,
        "memory_bytes": 4294967296,
        "pods": 110
      },
      "exclusion_reasons": [],
      "node": "node-a",
      "remaining": {
        "cpu_millicores": 2500,
        "memory_bytes": 4294967296,
        "pods": 110
      },
      "usable": true
    },
    {
      "accounting_status": "EXACT",
      "allocatable": {
        "cpu_millicores": 2500,
        "memory_bytes": 4294967296,
        "pods": 110
      },
      "exclusion_reasons": [],
      "node": "node-b",
      "remaining": {
        "cpu_millicores": 2500,
        "memory_bytes": 4294967296,
        "pods": 110
      },
      "usable": true
    }
  ],
  "formulation": {
    "constraints": [
      "sum_n x[p,n] <= 1 for every candidate p (at most one destination)",
      "x[p,n] exists only for M1-ELIGIBLE pairs on usable destinations (eligibility)",
      "sum_p cpu[p] * x[p,n] <= remaining_cpu[n] for every destination n",
      "sum_p mem[p] * x[p,n] <= remaining_memory[n] for every destination n",
      "sum_p x[p,n] <= remaining_pods[n] for every destination n"
    ],
    "objective": [
      "1. maximize sum x[p,n] (pods placed)",
      "2. maximize, lexicographically, the ascending vector over usable destinations of min_r (remaining_r[n] - used_r[n]) / allocatable_r[n] for r in cpu, memory, pods (leximin balance)",
      "3. minimize the tie-break vector over candidates in pod-key order: (0, node) if placed, (1, '') if not"
    ],
    "variables": "x[p,n] in {0,1} for each allowed (candidate p, destination n) pair listed in 'variables'"
  },
  "generator": {
    "milestone": "M2",
    "name": "qplace",
    "version": "0.1.0"
  },
  "limitations": [
    {
      "code": "REPLACEMENT_TEMPLATE_UNKNOWN",
      "detail": "replacement modeled from the current pod spec",
      "subject": "apps/batch-7a6b5c-aaaaa"
    },
    {
      "code": "REPLACEMENT_TEMPLATE_UNKNOWN",
      "detail": "replacement modeled from the current pod spec",
      "subject": "apps/indexer-8b7c6d-aaaaa"
    }
  ],
  "policy_excluded_pairs": [],
  "source": {
    "capacity_assessment_complete": true,
    "captured_at": "2026-10-10T09:00:00Z",
    "kubernetes_version": "v1.34.1",
    "snapshot_id": "m2-scenario-b-greedy-trap",
    "snapshot_schema_version": "1.0",
    "source_file": "scenario_b_greedy_trap.json",
    "source_sha256": "eafeae381b34f7d4749591bff4823a8055a14c6c1bb52e803154e72af39a9031",
    "source_type": "synthetic_fixture"
  },
  "summary": {
    "candidates": 2,
    "conditional": false,
    "destinations": 2,
    "usable_candidates": 2,
    "usable_destinations": 2,
    "variables": 3
  },
  "target_node": "source",
  "units": {
    "cpu": "millicores",
    "memory": "bytes",
    "pods": "count"
  },
  "variables": [
    {
      "index": 0,
      "node": "node-a",
      "pod": "apps/batch-7a6b5c-aaaaa"
    },
    {
      "index": 1,
      "node": "node-b",
      "pod": "apps/batch-7a6b5c-aaaaa"
    },
    {
      "index": 2,
      "node": "node-a",
      "pod": "apps/indexer-8b7c6d-aaaaa"
    }
  ]
}
