{
  "artifact": "placement_problem",
  "artifact_schema_version": "1.0",
  "candidates": [
    {
      "allowed_nodes": [
        "worker-01",
        "worker-02"
      ],
      "cpu_millicores": 1000,
      "exclusion_reasons": [],
      "ineligible_nodes": [],
      "memory_bytes": 268435456,
      "pod": "shop/api-5c6b7d-aaaaa",
      "replacement": "ASSUMED",
      "request_status": "EXACT",
      "unknown_nodes": [],
      "usable": true
    },
    {
      "allowed_nodes": [
        "worker-01",
        "worker-02"
      ],
      "cpu_millicores": 300,
      "exclusion_reasons": [],
      "ineligible_nodes": [],
      "memory_bytes": 1073741824,
      "pod": "shop/cart-0",
      "replacement": "ASSUMED",
      "request_status": "EXACT",
      "unknown_nodes": [],
      "usable": true
    },
    {
      "allowed_nodes": [
        "worker-01",
        "worker-02"
      ],
      "cpu_millicores": 500,
      "exclusion_reasons": [],
      "ineligible_nodes": [],
      "memory_bytes": 536870912,
      "pod": "shop/web-7d9f8c-aaaaa",
      "replacement": "ASSUMED",
      "request_status": "EXACT",
      "unknown_nodes": [],
      "usable": true
    },
    {
      "allowed_nodes": [
        "worker-01",
        "worker-02"
      ],
      "cpu_millicores": 600,
      "exclusion_reasons": [],
      "ineligible_nodes": [],
      "memory_bytes": 671088640,
      "pod": "shop/web-7d9f8c-bbbbb",
      "replacement": "ASSUMED",
      "request_status": "EXACT",
      "unknown_nodes": [],
      "usable": true
    }
  ],
  "conditions": [],
  "destinations": [
    {
      "accounting_status": "EXACT",
      "allocatable": {
        "cpu_millicores": 3900,
        "memory_bytes": 16106127360,
        "pods": 110
      },
      "exclusion_reasons": [],
      "node": "worker-01",
      "remaining": {
        "cpu_millicores": 3300,
        "memory_bytes": 15502147584,
        "pods": 108
      },
      "usable": true
    },
    {
      "accounting_status": "EXACT",
      "allocatable": {
        "cpu_millicores": 3900,
        "memory_bytes": 16106127360,
        "pods": 110
      },
      "exclusion_reasons": [],
      "node": "worker-02",
      "remaining": {
        "cpu_millicores": 2800,
        "memory_bytes": 15770583040,
        "pods": 108
      },
      "usable": true
    }
  ],
  "formulation": {
    "constraints": [
      "sum_n x[p,n] <= 1 for every candidate p (at most one destination)",
      "x[p,n] exists only for M1-ELIGIBLE pairs on usable destinations (eligibility)",
      "sum_p cpu[p] * x[p,n] <= remaining_cpu[n] for every destination n",
      "sum_p mem[p] * x[p,n] <= remaining_memory[n] for every destination n",
      "sum_p x[p,n] <= remaining_pods[n] for every destination n"
    ],
    "objective": [
      "1. maximize sum x[p,n] (pods placed)",
      "2. maximize, lexicographically, the ascending vector over usable destinations of min_r (remaining_r[n] - used_r[n]) / allocatable_r[n] for r in cpu, memory, pods (leximin balance)",
      "3. minimize the tie-break vector over candidates in pod-key order: (0, node) if placed, (1, '') if not"
    ],
    "variables": "x[p,n] in {0,1} for each allowed (candidate p, destination n) pair listed in 'variables'"
  },
  "generator": {
    "milestone": "M2",
    "name": "qplace",
    "version": "0.1.0"
  },
  "limitations": [
    {
      "code": "NON_CANDIDATE_TARGET_PODS",
      "detail": "kube-system/node-exporter-worker-03:DAEMONSET",
      "subject": "worker-03"
    },
    {
      "code": "PDB_ADVISORY",
      "detail": "PDB_ADVISORY_ONLY",
      "subject": "shop/web-pdb"
    },
    {
      "code": "REPLACEMENT_TEMPLATE_UNKNOWN",
      "detail": "replacement modeled from the current pod spec",
      "subject": "shop/api-5c6b7d-aaaaa"
    },
    {
      "code": "REPLACEMENT_TEMPLATE_UNKNOWN",
      "detail": "replacement modeled from the current pod spec",
      "subject": "shop/cart-0"
    },
    {
      "code": "REPLACEMENT_TEMPLATE_UNKNOWN",
      "detail": "replacement modeled from the current pod spec",
      "subject": "shop/web-7d9f8c-aaaaa"
    },
    {
      "code": "REPLACEMENT_TEMPLATE_UNKNOWN",
      "detail": "replacement modeled from the current pod spec",
      "subject": "shop/web-7d9f8c-bbbbb"
    }
  ],
  "policy_excluded_pairs": [],
  "source": {
    "capacity_assessment_complete": true,
    "captured_at": "2026-10-01T09:00:00Z",
    "kubernetes_version": "v1.34.1",
    "snapshot_id": "fixture-a-healthy",
    "snapshot_schema_version": "1.0",
    "source_file": "fixture_a_healthy.json",
    "source_sha256": "9525703e0b2d45e72369401fdbc70ef241b97a18b4063538e9759ba4d55843b0",
    "source_type": "synthetic_fixture"
  },
  "summary": {
    "candidates": 4,
    "conditional": false,
    "destinations": 2,
    "usable_candidates": 4,
    "usable_destinations": 2,
    "variables": 8
  },
  "target_node": "worker-03",
  "units": {
    "cpu": "millicores",
    "memory": "bytes",
    "pods": "count"
  },
  "variables": [
    {
      "index": 0,
      "node": "worker-01",
      "pod": "shop/api-5c6b7d-aaaaa"
    },
    {
      "index": 1,
      "node": "worker-02",
      "pod": "shop/api-5c6b7d-aaaaa"
    },
    {
      "index": 2,
      "node": "worker-01",
      "pod": "shop/cart-0"
    },
    {
      "index": 3,
      "node": "worker-02",
      "pod": "shop/cart-0"
    },
    {
      "index": 4,
      "node": "worker-01",
      "pod": "shop/web-7d9f8c-aaaaa"
    },
    {
      "index": 5,
      "node": "worker-02",
      "pod": "shop/web-7d9f8c-aaaaa"
    },
    {
      "index": 6,
      "node": "worker-01",
      "pod": "shop/web-7d9f8c-bbbbb"
    },
    {
      "index": 7,
      "node": "worker-02",
      "pod": "shop/web-7d9f8c-bbbbb"
    }
  ]
}
