{
  "artifact": "placement_problem",
  "artifact_schema_version": "1.0",
  "candidates": [
    {
      "allowed_nodes": [
        "node-db"
      ],
      "cpu_millicores": 2000,
      "exclusion_reasons": [],
      "ineligible_nodes": [
        "node-general"
      ],
      "memory_bytes": 4294967296,
      "pod": "data/db-1a2b3c-aaaaa",
      "replacement": "ASSUMED",
      "request_status": "EXACT",
      "unknown_nodes": [],
      "usable": true
    },
    {
      "allowed_nodes": [
        "node-general"
      ],
      "cpu_millicores": 500,
      "exclusion_reasons": [],
      "ineligible_nodes": [
        "node-db"
      ],
      "memory_bytes": 1073741824,
      "pod": "web/front-2b3c4d-aaaaa",
      "replacement": "ASSUMED",
      "request_status": "EXACT",
      "unknown_nodes": [],
      "usable": true
    },
    {
      "allowed_nodes": [
        "node-general"
      ],
      "cpu_millicores": 500,
      "exclusion_reasons": [],
      "ineligible_nodes": [
        "node-db"
      ],
      "memory_bytes": 1073741824,
      "pod": "web/front-2b3c4d-bbbbb",
      "replacement": "ASSUMED",
      "request_status": "EXACT",
      "unknown_nodes": [],
      "usable": true
    }
  ],
  "conditions": [],
  "destinations": [
    {
      "accounting_status": "EXACT",
      "allocatable": {
        "cpu_millicores": 8000,
        "memory_bytes": 34359738368,
        "pods": 110
      },
      "exclusion_reasons": [],
      "node": "node-db",
      "remaining": {
        "cpu_millicores": 8000,
        "memory_bytes": 34359738368,
        "pods": 110
      },
      "usable": true
    },
    {
      "accounting_status": "EXACT",
      "allocatable": {
        "cpu_millicores": 1000,
        "memory_bytes": 2147483648,
        "pods": 110
      },
      "exclusion_reasons": [],
      "node": "node-general",
      "remaining": {
        "cpu_millicores": 1000,
        "memory_bytes": 2147483648,
        "pods": 110
      },
      "usable": true
    }
  ],
  "formulation": {
    "constraints": [
      "sum_n x[p,n] <= 1 for every candidate p (at most one destination)",
      "x[p,n] exists only for M1-ELIGIBLE pairs on usable destinations (eligibility)",
      "sum_p cpu[p] * x[p,n] <= remaining_cpu[n] for every destination n",
      "sum_p mem[p] * x[p,n] <= remaining_memory[n] for every destination n",
      "sum_p x[p,n] <= remaining_pods[n] for every destination n"
    ],
    "objective": [
      "1. maximize sum x[p,n] (pods placed)",
      "2. maximize, lexicographically, the ascending vector over usable destinations of min_r (remaining_r[n] - used_r[n]) / allocatable_r[n] for r in cpu, memory, pods (leximin balance)",
      "3. minimize the tie-break vector over candidates in pod-key order: (0, node) if placed, (1, '') if not"
    ],
    "variables": "x[p,n] in {0,1} for each allowed (candidate p, destination n) pair listed in 'variables'"
  },
  "generator": {
    "milestone": "M2",
    "name": "qplace",
    "version": "0.1.0"
  },
  "limitations": [
    {
      "code": "REPLACEMENT_TEMPLATE_UNKNOWN",
      "detail": "replacement modeled from the current pod spec",
      "subject": "data/db-1a2b3c-aaaaa"
    },
    {
      "code": "REPLACEMENT_TEMPLATE_UNKNOWN",
      "detail": "replacement modeled from the current pod spec",
      "subject": "web/front-2b3c4d-aaaaa"
    },
    {
      "code": "REPLACEMENT_TEMPLATE_UNKNOWN",
      "detail": "replacement modeled from the current pod spec",
      "subject": "web/front-2b3c4d-bbbbb"
    }
  ],
  "policy_excluded_pairs": [],
  "source": {
    "capacity_assessment_complete": true,
    "captured_at": "2026-10-10T09:00:00Z",
    "kubernetes_version": "v1.34.1",
    "snapshot_id": "m2-scenario-d-eligibility",
    "snapshot_schema_version": "1.0",
    "source_file": "scenario_d_eligibility.json",
    "source_sha256": "db51a686c6be132912f4446a006a90d1e742e9e88ee232ea395766220789f690",
    "source_type": "synthetic_fixture"
  },
  "summary": {
    "candidates": 3,
    "conditional": false,
    "destinations": 2,
    "usable_candidates": 3,
    "usable_destinations": 2,
    "variables": 3
  },
  "target_node": "source",
  "units": {
    "cpu": "millicores",
    "memory": "bytes",
    "pods": "count"
  },
  "variables": [
    {
      "index": 0,
      "node": "node-db",
      "pod": "data/db-1a2b3c-aaaaa"
    },
    {
      "index": 1,
      "node": "node-general",
      "pod": "web/front-2b3c4d-aaaaa"
    },
    {
      "index": 2,
      "node": "node-general",
      "pod": "web/front-2b3c4d-bbbbb"
    }
  ]
}
